text,topic
"New water in town for molecular biology! It's a new Milli-Q water that make your experiments nicer.


It's called Milli-Cute water",just study like
Ovidio Guzmán buscar ser testigo colaborador de EU; aprueban plan fiscal de Trump - Prensa nacional ,que na sa
21m looking for friends I’m down to talk about whatever as long as it’s nothing to crazy ,just study like
Everything tbh ,just study like
"Streaming xplane For those of you who stream Xplane, what volume level do you have the sim set at in the setting and what are your OBS Studio decibel settings? ",just study like
My new P365 Decided to go the 365x w/macro grip for the flush radian fit.,weight gym muscle
"LGBTQ Powerfull Spells for lost love Are you yearning to reconnect with a lost love or attract a relationship that truly reflects your authentic self? Whether you're seeking to rekindle an old flame or attract a new partner who celebrates your true identity, I have powerful spells to guide and support you every step of the way. Embrace your authentic love story with confidence and magic.  
Visit my Website: [strongspells.com](https://www.strongspells.com/)  
  
",just study like
Daniel Wilcox (@drwilcox2010) on Threads ,book books read
The MCL39 at Silverstone “Ever,just study like
"Lol ""let's listen to some the caretaker! :D""

""wait wtf? Vvm für test?! The Furtaker!? REPETITION OF BLUE DOG FURSONAS??!! WHO ARE THEY PEOPLE ON THE COVER?"" ",cat dog cats
Autograph - Turn up the Radio ,just study like
"Can I use GnuCash with my gf? Hi! Noob question. I want to track my expenses from one side but also my gf's one, but not as a whole but on two separate accounts, and maybe later see the net total as one. Is it possible? Thanks.",just study like
"Top F.D.A. Official Overrode Scientists on Covid Shots Perhaps the silver lining are his comments on rare diseases

>Some see the changes as a hopeful sign: Dr. Prasad rose to prominence as an academic who exhorted the F.D.A. to reserve its stamp of approval for drugs that demonstrated crystal-clear benefits. (He has said recently that he will be more flexible with drugs for rare diseases.)",jr covid panel
American capitalism: 1) Cut & privatize public services. 2) Use savings to hand tax breaks & gov’t contracts to donors. 3) Make you work harder to afford basics. 4) Use Fox News to yell “socialism” at anything that helps you. 5) Keep white people tuned in w/ hate for brown people. Profit. Repeat. ,just study like
"How to not get caught up in comparisons? This is probably something many people here experience.

I'm a younger person and I'm on track to being  HENRY, and although I recognise I'm in a great situation and I'm grateful to have what I have, I'm
always comparing myself to those who have more. 

I have mates who went to Oxford who got really high paying jobs, and even though I also have a high paying job, they make a lot more than I do. I know their jobs come with a lot of stress but their salary scales quickly each year and can make 50%+ bonus easily. 

I know ""comparison is the thief of joy"" yada yada but how do you actually stop getting caught up with comparisons and ""keeping up with the joneses""? 

It's something that many high earners still fall into the trap of - you see so many high earners still living paycheck to paycheck or complaining that they ""can't afford to save money"" despite earning high 6 figure salaries but when you look into their expenditure the 'bare minimum' is expensive cars, expensive watches and multiple holidays, costly private schools/nurseries for their kids etc - all to mostly keep up with their other high earning friends in their social circles. 

",just study like
4-5 month old conure weight I adopted this baby sun cheek conure last weekend and the bird store said that it is 4-5 months old. It weighs 53 grams is that typically normal for a weight at this age?,just study like
"IDR Application question Hi all, hoping that someone may have encountered this problem on FSA before and has advice for how to proceed.

I have been in SAVE limbo and after a few months of doing nothing (due to fatigue and feeling discouraged after my IBR application seemed to just miss the review cutoff back in February) I am trying to get back on IBR so I can start making payments (I’m a little over halfway and just got back into public service in January). I went to FSA today and completed the IDR application. I downloaded the completed application and noticed that even though I indicated when I started that I wanted to switch my current IDR plan, on the form, “I am submitting documentation early to have my income-driven payment recalculated immediately” is what is checked.

I thought maybe I made a mistake, so I submitted another one, but I saw the same problem. I ended up revoking my IRS consent because I also noticed that the application wasn’t showing my family size, and the only way to have my dependent included was to remove IRS access so I could manually answer that question. I also had a significant drop in income since going back to public and despite answering the question about that, that box (as well as the questions about whether I have taxable income) are both unchecked, despite the fact that I checked them.

Has anyone encountered issues with their FSA application reflecting their responses correctly? I don’t want to keep submitting these via FSA if they’re incorrect, but I am unsure whether the wet signature/upload to servicer is still recommended.

Thanks in advance 🙏🏻",study studying help
Carmelo Hayes Elite Custom Carmelo Hayes head on an elite 90 Mustafa Ali body. Skin tones slightly off,just study like
Saddest day of my life Blox fruit average just dropped drastically I'm sad that the game is dying Devs pls fix the game ,game https com
"Nose Design We are a beginner team in FS, i want to know where should i start for nose design? any material that i can refer to....?",art status source https
Ichikawa Gameplay ,anime reddit com comments
